name,ring,quadrant,isNew,hasMovedIn,hasMovedOut,description
Advanced analytics,adopt,techniques,TRUE,FALSE,FALSE,"Machine learning, semantic analysis, text mining, quantitative analytics, and other advanced analytics techniques have steadily matured over the past 15 years. They offer incredible potential for prediction, forecasting, identifying repeatable patterns, and providing insight into unstructured data. Historically, our ability to store and rapidly analyze large amounts of audio, video and image data has been severely limited. This placed constraints on sample size, as well as the time it would take to validate analytical models and put them into production. Now, using a spectrum of new technologies like NoSQL, data harvesters, MapReduce frameworks, and clusters of shared-nothing commodity servers, we have the power necessary to make truly effective use of these techniques. Combined with the massive increase in global data available from sensors, mobile devices and social media and we see this as a field with tremendous opportunity."
Aggregates as documents,adopt,techniques,TRUE,FALSE,FALSE,""
Automated deployment pipeline,adopt,techniques,TRUE,FALSE,FALSE,""
Guerrilla user testing,adopt,techniques,TRUE,FALSE,FALSE,""
Health check pages,adopt,techniques,FALSE,FALSE,FALSE,"We have found adding simple health check pages to applications is incredibly useful. This allows people to quickly understand the health of an individual node. We often extend them to add metrics like the number of orders placed, error rates, or similar information. Using simple embedded web servers, even non-web based services can easily expose internal information over HTTP. By using microformats, these web pages can easily be scraped by other monitoring tools to become part of holistic monitoring."
In-process acceptance testing,adopt,techniques,TRUE,FALSE,FALSE,""
Infrastructure as code,adopt,techniques,FALSE,FALSE,FALSE,"We continue to highlight infrastructure as code. This technique treats infrastructure configuration in the same way as code; checking configuration into source control, then carefully pushing changes out to the data center."
Windows infrastructure automation,adopt,techniques,FALSE,TRUE,FALSE,"Mature tools such as PowerShell, together with newer options such as Chef and Puppet, lead us to highlight Windows infrastructure automation on this edition of the technology radar. Manual configuration using a mouse and menu options is slow and leads to misconfiguration and “snowflake” machines in an unknown state. We recommend command-line tools for their clarity and scriptability."
Work-in-Progress limits,adopt,techniques,TRUE,FALSE,FALSE,"It might sound odd for us to mention this, given how mainstream Agile development has become, but we are noticing teams rediscover and embrace work-in-progress limits. Methods such as Kanban limit the amount of in-flight work, forcing better workflow into the team and more visibility into bottlenecks."
Agile analytics,trial,techniques,FALSE,FALSE,FALSE,"Applying agile methods to data warehousing, business intelligence and agile analytics provides better return and improved business responsiveness. This is done by applying lightweight technologies like REST services to move data around in near real-time instead of batch updates. This allows information about customer behavior and application usage to be derived and responses incorporated within the applications for better user experience and data visualization."
Configuration in DNS,trial,techniques,TRUE,FALSE,FALSE,"Application deployments often suffer from an excess of environment-specific configuration settings, including the hostnames of dependent services. Configuration in DNS is a valuable technique to reduce this complexity by using standard hostnames like ‘mail’ or ‘db’ and have DNS resolve to the correct host for that environment. This can be achieved in multiple ways, including split-horizon DNS or configuring search subdomains. Collaboration between development teams and IT operations is essential to achieve this, but that is unfortunately still difficult in some organizations."
Declarative provisioning,trial,techniques,TRUE,FALSE,FALSE,"Tools such as Pallet offer a compelling approach to environment creation and management through declarative provisioning. Usually, this is accomplished by declaring your environment topology - a number of instances, OS, network configuration and applications - using a DSL, and then creating the entire environment automatically via a commandline tool. This approach differs in the decoupling of instance creation and application provision, and in the addition of the ability to declare dependencies between domain-specific application-level services over multiple boxes."
Edge Side Includes for page composition,trial,techniques,TRUE,FALSE,FALSE,""
Infrastructure automation of development workstations,trial,techniques,FALSE,FALSE,FALSE,"Automation is one of the core practices of Continuous Delivery. While companies are getting better at automating the management of infrastructure and environments, one commonly forgotten aspect is infrastructure automation of development workstations. This leads to huge gains in productivity by avoiding manually building specific environments and allows a seamless pairing environment. As with other parts of the environment, tools like Puppet and Chef can be used though they are not entirely necessary as the judicious use of platform packaging and language build tools can be sufficient."
Logs as data,trial,techniques,TRUE,FALSE,FALSE,""
Microservices,trial,techniques,FALSE,TRUE,FALSE,""
Mobile first,trial,techniques,TRUE,FALSE,FALSE,""
Out-of-container functional testing,trial,techniques,FALSE,FALSE,FALSE,"With the popularity of embedded HTTP servers increasing, so has the technique of out-of-container functional testing. That is writing tests at the boundary of the system, using a mock container to provide both fast feedback and high coverage. Servers such as Jetty and tools like Plasma for the .Net platform can provide a significant reduction in the time it takes to run your test suite."
Performance testing as a first-class citizen,trial,techniques,FALSE,FALSE,FALSE,""
Polyglot Persistence,trial,techniques,FALSE,FALSE,FALSE,"Polyglot persistence is the technique of storing data in various data stores based on efficiency and how that data is going to be used. Do not just use the default database, often an RDBMS, for all the needs of the application. Instead, ask questions like: Does session management data belong in the database or does it belong in a key-value store? Do relationships between customers and products belong in a graph database? Using NoSQL databases like MongoDB, Riak and Neo4J allows us to reconsider how data is treated, even with-in a single application."
Remote usability testing,trial,techniques,TRUE,FALSE,FALSE,"Bringing users in to a controlled environment for formal testing can be a slow and expensive proposition. Much useful, qualitative feedback can be gathered quickly and cheaply through guerrilla user testing - by going out into the world and testing with small samples of the general public. Another alternative is remote usability testing, where you can send out everything from wireframes to final applications for testing by people all over the world. Usabila, Loop11 and Treejack all provide tools where you can ask users to carry out specific tasks, and capture everything from the time taken to complete a task, to the user’s thoughts and feelings while doing so."
Responsive web design,trial,techniques,TRUE,FALSE,FALSE,""
Semantic monitoring,trial,techniques,TRUE,FALSE,FALSE,""
Deployment and scripting test tools,assess,techniques,TRUE,FALSE,FALSE,"With deployment automation tools maturing, including PowerShell on Windows, scripts are increasingly sophisticated and contain a lot of logic. We recommend deployment and scripting test tools, such as Pester for PowerShell and TOFT for Chef and Puppet. It is critical to have good test coverage around the most important aspects of your deployment automation."
Database based integration,hold,techniques,FALSE,FALSE,FALSE,"For those organizations that are required to integrate systems, many continue to use a common database, sharing data between applications through the database tier. In many cases this has become an established and accepted architectural pattern: database based integration. The side affect of such an approach is greater coupling of database schemas, release schedules, performance and quality of service across applications."
Exhaustive browser based testing,hold,techniques,TRUE,FALSE,FALSE,""
Feature branching,hold,techniques,FALSE,FALSE,FALSE,"Disappointingly, we continue to see development teams embrace the practice of feature branching to isolate work and defer integration. Feature branches commonly cause significant pain and unpredictability during late merges, but more importantly prevent the continual design improvement necessary to maintain high quality software. We recommend continuous integration and branch by abstraction as an alternative to feature branching."
Test recorders,hold,techniques,FALSE,FALSE,FALSE,"Test recorders seem invaluable as they provide a quick way to capture navigation through an application. However, we strongly advise against their regular use, as it tends to result in brittle tests which break with small changes to the UI. The test code they produce tends to be relatively poor and riddled with unnecessary duplication. Most importantly, test recorders tend to cut channels of communication between the test automation and development teams. When faced with an application that is difficult to test through the user interface, the solution is to have a critical conversation between the teams to build a more testable UI."
ATOM,adopt,platforms,FALSE,FALSE,FALSE,"One of the foundational technologies of the Web as platform, Atom is an extensible data syndication format with broad tool support in almost all languages. In conjunction with the Atom Publication Protocol, Atom comprises a lightweight platform for publishing and consuming data with high quality-of-service guarantees. Atom-based solutions trade scalability for latency, however, making Atom often inappropriate for very low-latency scenarios."
Care about hardware,adopt,platforms,FALSE,FALSE,FALSE,"This platform was included in this edition of the Radar for visibility. We felt that there wasn't anything substantial to add to the discourse around it, but that it was important to keep this in view."
Mobile payment systems,adopt,platforms,TRUE,FALSE,FALSE,"Despite apparent resistance in the Global North, mobile payment systems such as Kenya’s M-Pesa are providing secure cashless monetary transactions. With the service rolling out across Africa, the system opens up the market for the millions of people with mobile phones but lacking access to traditional banking outlets. Providers such as Square are slowly improving the situation, but the North continues to lag."
Neo4J,adopt,platforms,FALSE,TRUE,FALSE,""
Continuous integration in the cloud,trial,platforms,TRUE,FALSE,FALSE,""
Couchbase,trial,platforms,TRUE,FALSE,FALSE,""
Domain-specific PaaS,trial,platforms,FALSE,FALSE,FALSE,"We find that many businesses are starting to build their own internal cloud deployment environments that can be easily replicated for development and testing environments. In many cases, provisioning is selfservice, and with a single keystroke, developers can create a set of hosts that implement core enterprise assets and collaborating systems. In a sense, this is a domain-specific PaaS offered to internal customers."
Hybrid clouds,trial,platforms,FALSE,TRUE,FALSE,"Hybrid clouds combine the best features of public clouds and private data centers. They allow applications to run in a private data center during normal periods, and then use rented space in a public cloud for overflow capacity during peak traffic periods. There are now a number of infrastructure solutions that allow automatic and consistent deployment across a hybrid cloud, such as Palette and RightScale. With robust offerings from Amazon, Rackspace and others, we are moving hybrid clouds to “Trial” on this edition of the radar."
Linux containers,trial,platforms,FALSE,FALSE,FALSE,"One style of virtualization that is particularly attractive for SaaS and PaaS implementations is the virtual container. Linux containers such as OpenVZ provide the isolation and management benefits of a virtual machine without the overhead usually associated with general-purpose virtualization. In the container model, the guest OS is limited to being the same as the underlying host OS, but that is not a serious limitation for many cloud applications."
MongoDB,trial,platforms,TRUE,FALSE,FALSE,"For problems that fit the document databases model, MongoDB provides easy programmability, a query interface, high availability with automated failover, and automated sharding capabilities. It allows for a smooth transition to NoSQL data stores from the RDBMS model, with the inclusion of familiar concepts, such as the ability to define indexes."
Node.js,trial,platforms,FALSE,TRUE,FALSE,"For many years JavaScript was predominantly used as a client side Web programming language, but a lightweight language such as JavaScript can easily be embedded in different environments, including the server side. Node.js allows developers to write applications in JavaScript on both client and server sides. Since most servers spend the majority of their time waiting for I/O operations, Node.js’ event driven non-blocking architecture is very efficient. Unlike threadbased solutions, Node.js does not need to wait for I/O operations to complete while processing incoming requests, making it a good choice when implementing high performance services."
Private Clouds,trial,platforms,FALSE,FALSE,FALSE,"Because of concerns over privacy and security, or a need to repurpose existing hardware investments, many businesses are choosing to implement their own private cloud. There are are a variety of products, both open source and commercial for this purpose, but it should be noted that compute, storage, and network management are only the starting points for a useful private cloud. There are many services and processes that must be custom implemented to provide a cloud facility that rivals the public offerings from Amazon, Rackspace, or others."
Riak,trial,platforms,FALSE,TRUE,FALSE,""
Single threaded servers with asynchronous I/O,trial,platforms,FALSE,TRUE,FALSE,"Node.js is just one example of a class of single threaded servers with asynchronous I/O that are seeing increased popularity. A traditional web or application server associates each incoming request with a thread until all the processing tasks associated with that request are complete and the response has been sent back. If any of those tasks involve I/O, the thread blocks while that I/O takes place. This approach can waste finite resources such as file descriptors and memory since each connection occupies a thread whether or not that thread is actually consuming CPU cycles. An alternative architecture is starting to emerge in implementations like Node.js (a JavaScript server running on Google V8), Nginx (an open source web server and proxy), and Webbit (a Java application server), that uses a single thread to serve many connections, processing all I/O asynchronously. These servers support orders of magnitude more simultaneous connections because each one consumes far fewer resources."
Azure,assess,platforms,TRUE,FALSE,FALSE,""
BigQuery,assess,platforms,TRUE,FALSE,FALSE,"Google’s BigQuery brings data analytics to the cloud. Rather than loading data into an expensive data-warehouse with predefined indexes, BigQuery allows you to upload and investigate a data set through ad-hoc SQL-like queries. This is a great way to create a cheap proof-of-concept or even a complete application, as processing of hundreds of gigabytes of data by thousands of servers happens in seconds."
Calatrava,assess,platforms,TRUE,FALSE,FALSE,""
Datomic,assess,platforms,TRUE,FALSE,FALSE,""
Open source IaaS,assess,platforms,TRUE,FALSE,FALSE,"Selecting the right cloud provider from an almost bewildering array of options continues to be difficult. One strategy is to adopt an open source IaaS platform such as OpenStack or CloudStack. This allows you to run a private cloud that is consistent with a public cloud, and to migrate from one cloud provider to another should the need arise. Going one step further, Apache’s Deltacloud abstracts away from specific provider APIs to give a consistent experience across cloud platforms."
Vert.x,assess,platforms,TRUE,FALSE,FALSE,"Representing yet another evolution away from traditional, free-standing application containers, Vert.x is an application framework that bridges synchronous and asynchronous programming styles. This gives the programmer the option to trade off scalability and performance for simplicity. Unlike Node.js, Vert.x is a library that can be called from a variety of languages supported on the JVM, including Java, Ruby and JavaScript."
Windows Phone,assess,platforms,FALSE,FALSE,TRUE,"Despite a promising start to Windows Phone, a well thought-out user interface, and probably the best development experience of any mobile platform, we have seen several stumbles in the execution of the platform strategy by Microsoft and its partners. This makes us less optimistic about the future of the platform than we were in the last radar."
Java portal servers,hold,platforms,FALSE,FALSE,FALSE,"A continuing cause of delivery problems lies in the use of Java Portal Server packages. These problems occur in both open source and commercial portal platforms. The promised productivity of these platforms is hindered by their complex and unwieldy programming models and difficulty in automating deployment, data migration, and tests. Although product demos are compelling, the base features of portal products are often a poor fit for real web applications, while the extra advertised features such as single sign-on or search are usually already served by existing, targeted, enterprise assets."
Meteor.js,hold,platforms,TRUE,FALSE,FALSE,"Meteor.js is a client- and server-side JavaScript application framework, run inside a web browser, or in a Node.js container, and backed by MongoDB for persistence. It uses “Smart Packages” - little bundles of code that can run in the browser or as part of a cloud service. It allows hot code deploys and live in-browser updates. We think the idea is great, even if the framework is not yet ready for primetime."
Singleton infrastructure,hold,platforms,TRUE,FALSE,FALSE,""
WS-*,hold,platforms,FALSE,FALSE,FALSE,""
Zero-code packages,hold,platforms,FALSE,FALSE,FALSE,"There are a number of enterprise software packages on the market that purport to offer flexible functionality with zero coding. This is certainly an appealing notion – that a non-technical business user could configure software to the unique requirements of any business without learning a programming language or hiring a professional software developer. However, it should be kept in mind that any change that affects the behavior of software in production, whether it is code, configuration, data or environments, could cause defects or failures in the business system. Writing code is only one step in a professional software production lifecycle. The need for repeatable analysis, testing, build, and deployment does not go away because the system is modified via a dragand- drop interface instead of a high-level programming language. When evaluating a zero-code package, ensure that the the product supports these processes and that you have the necessary IT support structures in place to implement them."
AppCode,adopt,tools,TRUE,FALSE,FALSE,"Apple’s mobile devices are going strong and native apps are a cornerstone of their success. Writing these native apps has become much more pleasant and productive since JetBrains launched AppCode, an IDE for iOS and OS X development that replicates the strengths of their IDEs for other platforms."
Embedded servlet containers,adopt,tools,FALSE,TRUE,FALSE,"We have talked much already about embedded servlet containers - and these are now widely adopted on our projects. Tools such as SimpleWeb and Webbit take the simple, embedded approach further and offer raw HTTP server functionality without implementing the Java Servlet specification. We are pleased to see a corresponding reduction in the complexity of test code that takes advantage of this."
Graphite,adopt,tools,TRUE,FALSE,FALSE,""
Immutable servers,adopt,tools,TRUE,FALSE,FALSE,""
Silverback,adopt,tools,TRUE,FALSE,FALSE,"There are a couple of usability testing tools that match our preferred ‘guerrilla’ approach. Eye-tracking has long been a useful technique when designing compelling user interfaces, however the equipment and software associated with it is expensive and typically requires the use of specialist firms. Crazy Egg is a cheaper, software-only solution that produces heat maps based on mouse movement. This movement has a strong correlation with gaze, and can be used as a reasonable approximation. Silverback captures not only the screen during a test, but also records the face and voice of the user. This can be invaluable in sharing rich test experiences with the wider development team."
Apache Pig,trial,tools,TRUE,FALSE,FALSE,""
D3,trial,tools,TRUE,FALSE,FALSE,"D3 is a JavaScript library for binding datasets into the DOM, and then declaratively transforming the document to create rich visualizations - ranging from graphs to heatmaps. With support for HTML, CSS and SVG, and an extensible plug-in model, we like the fact that this library allows us to deliver information in more intuitive ways."
Dependency Structure Matrices,trial,tools,TRUE,FALSE,FALSE,"We strongly favor code-base visualization techniques. In particular, Dependency Structure Matrices (DSM) have proven to be extremely useful, especially in support of an evolutionary architecture and emergent design. Tools support for DSM is widespread."
Frank,trial,tools,FALSE,FALSE,FALSE,""
Gradle,trial,tools,FALSE,TRUE,FALSE,"Two things have caused fatigue with XML-based build tools like Ant and Maven: too many angry pointy braces and the coarseness of plug-in architectures. While syntax issues can be dealt with through generation, plug-in architectures severely limit the ability for build tools to grow gracefully as projects become more complex. We have come to feel that plug-ins are the wrong level of abstraction, and prefer language-based tools like Gradle and Rake instead, because they offer finer-grained abstractions and more flexibility long term."
Highcharts,trial,tools,TRUE,FALSE,FALSE,"Increasingly performant JavaScript engines, combined with widespread support for embedded SVG documents in HTML, has lead to pure JavaScript-based client-side graphing and visualization solutions gaining a lot of traction. Highcharts is one of the best ones we have come across, with out-of-the-box support for multiple highly-configurable interactive chart types, and the ability to easily render large data sets."
Jade,trial,tools,FALSE,FALSE,FALSE,"This tool was included in this edition of the Radar for visibility. We felt that there wasn't anything substantial to add to the discourse around it, but that it was important to keep this in view."
JavaScript micro frameworks,trial,tools,FALSE,FALSE,FALSE,"With mobile applications on the rise, JavaScript size and performance is even more critical. JavaScript micro frameworks have emerged as a direct response to ‘bloat’ in some of the larger libraries. These small libraries do exactly one thing, such as DOM selection or MVC, and can be under one kilobyte in size. By combining a number of micro frameworks, developers can get exactly the functionality they need without the overhead of a larger library. Microjs.com hosts a collection of these micro frameworks, as well as a tool that can bundle them into a single library."
Jekyll,trial,tools,TRUE,FALSE,FALSE,""
Locust,trial,tools,TRUE,FALSE,FALSE,""
NuGet,trial,tools,FALSE,FALSE,FALSE,"Package management systems are a widely accepted practice for incorporating third party libraries. Tools such as RubyGems, Maven, APT, are available at both language and system level. NuGet is such a system for .Net platform. It consists of a Visual Studio IDE extension and a PowerShell module that opens the possibility for further improving build automation on the .Net platform."
PSake,trial,tools,FALSE,FALSE,FALSE,""
Rake for Java &amp; .NET,trial,tools,TRUE,FALSE,FALSE,"Of all the build tools and languages we use across our projects, the one we keep coming back to is Rake. Rake is a beautiful, simple and powerful build language implemented as an internal Domain-Specific Language on Ruby. Ruby’s ability to run across several virtual-machine platforms means that Rake is equally available - while leaving open the option to utilize more language-specific tools for some tasks. Finding a similar combination of elegance and flexibility is difficult regardless of your platform, so we recommend trying Rake for Java and .Net projects."
SaaS performance testing tools,trial,tools,TRUE,FALSE,FALSE,"Rather than wrestling with licenses and setting up clusters of machines for performance testing, we’re seeing a rise in SaaS performance testing tools such as Blitz.io and Tealeaf. These services make it easy to run performance tests with a huge number of geographically diverse clients, without investing heavily in infrastructure."
