name,ring,quadrant,isNew,hasMovedIn,hasMovedOut,description
Vagrant,trial,tools,FALSE,FALSE,FALSE,"The tool Vagrant makes it simple for teams to distribute virtualized development environments constructed using version-control friendly descriptors. Vagrant helps eliminate environmental differences in development and reduce troubleshooting waste."
Crazy Egg,assess,tools,TRUE,FALSE,FALSE,"There are a couple of usability testing tools that match our preferred ‘guerrilla’ approach. Eye-tracking has long been a useful technique when designing compelling user interfaces, however the equipment and software associated with it is expensive and typically requires the use of specialist firms. Crazy Egg is a cheaper, software-only solution that produces heat maps based on mouse movement. This movement has a strong correlation with gaze, and can be used as a reasonable approximation. Silverback captures not only the screen during a test, but also records the face and voice of the user. This can be invaluable in sharing rich test experiences with the wider development team."
GemJars,assess,tools,TRUE,FALSE,FALSE,"In a mixed Ruby/Java application, running on the JVM, there are differences in package format and dependency resolution that need to be dealt with. By providing an Ivy compatible proxy that packages RubyGems as JARs and uses Ivy to resolve Gem dependencies, GemJars consolidates and simplifies the building of truly polyglot codebases."
Light Table,assess,tools,TRUE,FALSE,FALSE,""
Logic-free markup,assess,tools,FALSE,FALSE,FALSE,"While MVC has been a staple of web development for the past few years, most libraries and frameworks fail to adhere to one of its most important principles: keeping logic out of the view layer. The consequences of not having logicfree markup include complex dependencies, difficulty testing and inability to reuse code. Recent DSLs like Mustache are available for many languages and platforms and have started to turn the trend. They allow editing in any tool, without extra requirements for language support and provide huge gains for UI development and overall application design."
Riemann,assess,tools,TRUE,FALSE,FALSE,""
Zipkin,assess,tools,TRUE,FALSE,FALSE,"When building distributed applications to address web-scale or big data requirements, setting up appropriate monitoring tools becomes a non-trivial exercise. Zipkin is a tool that instruments the different components of a service-based system and visualizes the breakdown of logical requests passing through multiple services using a ‘firebug-like’ view. The raw data can be stored in Hadoop for more advanced reporting and data mining."
Zucchini,assess,tools,TRUE,FALSE,FALSE,"Zucchini is a testing framework that provides Cucumber-style BDD testing for iOS apps. It uses CoffeeScript for feature definitions, takes screenshots as tests are run, and we’ve been very happy with it."
ESB,hold,tools,FALSE,FALSE,FALSE,"IT departments are increasingly striving to liberate data from disparate systems. A broad set of approaches have been promoted under the generic term Service Oriented Architecture (SOA). This has led to confusion about what the term and approach actually means. We believe businesses do not need the complex enterprise service bus products advocated by vendors. ESBs actively undermine the reasons for choosing the bus approach: low latency, loose coupling, and transparency."
Maven,hold,tools,FALSE,FALSE,FALSE,"Maven has long been a staple of build automation in the Java space. However, given its lack of flexibility and support for automation best practices, especially in the Continuous Delivery domain, the use of alternatives such as Gradle should be considered."
VCS with “implicit workflow”,hold,tools,FALSE,FALSE,FALSE,"Some tools seek to enable and facilitate different ways of working. Unfortunately other tools are created using a different premise, one of low trust in users and the need to enforce a predefined process. ClearCase and TFS do this. This makes version control systems with “implicit workflow” unsuitable tools for modern agile software development. Project methodologies and the best ways of working on a project need to emerge. Tools that enforce high ceremony around things like check in just get in the way and kill productivity."
Care about languages,adopt,languages-and-frameworks,FALSE,FALSE,FALSE,"The industry is experiencing something of a renaissance in programming languages. Thoughtworks thinks it is time to start assessing which other languages will help your organization while taking stock of the useful lifetime remaining for your current choices. You need to care about languages. Traditionally structured organizations with separate support teams may find skills constrain choice, DevOps offers a path forwards here."
Clojure,adopt,languages-and-frameworks,FALSE,TRUE,FALSE,""
Jasmine paired with Node.js,adopt,languages-and-frameworks,TRUE,FALSE,FALSE,""
SASS, SCSS, LESS, and Stylus,adopt,languages-and-frameworks,FALSE,TRUE,FALSE,"CSS has been an extremely popular and effective DSL for styling web pages. It does, however, have some annoying limitations which have led to a number of languages that build on CSS to make it easier to write and modify. We’ve had good experiences with SASS, SCSS, and LESS."
Scala, the good parts,adopt,languages-and-frameworks,FALSE,TRUE,FALSE,""
AngularJS and Knockout,trial,languages-and-frameworks,TRUE,FALSE,FALSE,"We are seeing a common pattern of creating single-page web applications. Rather than requiring full page refresh, these request smaller sets of data from the server, and change the displayed content of their page through modifying the DOM. To make this more manageable, JavaScript MV* frameworks have been developed that support data binding, client-side templates, and validation. While lightweight applications may not need a framework, for more complex scenarios, AngularJS and Knockout should be considered as the current front-runners in this field."
Domain-Specific Languages,trial,languages-and-frameworks,FALSE,FALSE,FALSE,"Domain-Specific Languages is an old technique that we think is significantly under-used. We hope that the publication of Martin Fowler’s latest book will encourage more people to utilize them."
Dropwizard,trial,languages-and-frameworks,TRUE,FALSE,FALSE,""
HTML5 for offline applications,trial,languages-and-frameworks,FALSE,FALSE,FALSE,""
Require.js,trial,languages-and-frameworks,TRUE,FALSE,FALSE,"As adoption continues to expand, so does the size of many JavaScript codebases. To improve modularity of code and help manage this, we are seeing teams embrace libraries such as Require.js. Using the Asynchronous Module Definition (AMD) format, code is split into modules, easing development and maintenance, and an optimization tool then combines and minifies scripts for production deployment."
Scratch, Alice, and Kodu,trial,languages-and-frameworks,TRUE,FALSE,FALSE,""
Sinatra,trial,languages-and-frameworks,TRUE,FALSE,FALSE,"Micro-frameworks are emerging as a way to handle increasing complexity in applications both on client- and server-side. Sinatra was one of the early precursors of that trend in server-side space, exposing a lightweight DSL to build fast services that can be easily composed. Flask, Scalatra and Compojure are similar offerings for Python, Scala and Clojure respectively."
Twitter Bootstrap,trial,languages-and-frameworks,TRUE,FALSE,FALSE,""
ClojureScript,assess,languages-and-frameworks,FALSE,FALSE,FALSE,""
F#,assess,languages-and-frameworks,FALSE,FALSE,FALSE,"Microsoft’s F# continues to evolve, with the recent release of F# 3.0 beta. F# is excellent at concisely expressing business and domain logic. Developers trying to achieve explicit business logic within an application may opt to express their domain in F# with the majority of plumbing code in C#."
JavaScript as a platform,assess,languages-and-frameworks,TRUE,FALSE,FALSE,""
Lua,assess,languages-and-frameworks,TRUE,FALSE,FALSE,""
RubyMotion,assess,languages-and-frameworks,TRUE,FALSE,FALSE,""
Backbone.js,hold,languages-and-frameworks,FALSE,FALSE,TRUE,""
Component-based frameworks,hold,languages-and-frameworks,TRUE,FALSE,FALSE,""
Google Dart,hold,languages-and-frameworks,FALSE,FALSE,FALSE,"Dart is Google’s attempt at creating a programming language to replace JavaScript due to JavaScript’s perceived flaws and inherent performance issues. Dart, in line with previous Google languages, provides Java-like syntax and semantics that are intended to be more appealing than JavaScript’s prototype-based nature. Reception within the browser-development community has been understandably cool and it remains to be seen if the language will become more widely accepted, though Chrome’s continued rise and the search for alternatives like CoffeeScript may yet shift that balance."
Logic in stored procedures,hold,languages-and-frameworks,FALSE,FALSE,FALSE,""